[
  {
    "schema_version": "0.1.3",
    "event_id": "11111111-1111-4111-8111-111111111111",
    "event_name": "ai.task.queued",
    "occurred_at": "2026-07-29T09:00:00Z",
    "module": "ai",
    "result_status": "success",
    "source_type": "ai_service",
    "privacy_class": "internal_id",
    "project_id": "1",
    "project_version_id": "2",
    "object_type": "flow",
    "object_id": "3",
    "object_version_id": "4",
    "ai_task_id": "5",
    "ai_call_id": null,
    "ai_result_id": null,
    "trace_id": "trace-fixture-001",
    "command_id": "command-fixture-001",
    "correlation_id": "correlation-fixture-001",
    "causation_id": null,
    "idempotency_key": "command-fixture-001:ai.task.queued",
    "payload_json": {
      "task_status": "queued",
      "producer_component": "ai_api",
      "previous_status": "prechecking",
      "candidate_only": true
    }
  },
  {
    "schema_version": "0.1.3",
    "event_id": "33333333-3333-4333-8333-333333333333",
    "event_name": "ai.result.generated",
    "occurred_at": "2026-07-29T09:00:02Z",
    "module": "ai",
    "result_status": "success",
    "source_type": "worker",
    "privacy_class": "internal_id",
    "project_id": "1",
    "project_version_id": "2",
    "object_type": "flow",
    "object_id": "3",
    "object_version_id": "4",
    "ai_task_id": "5",
    "ai_call_id": "6",
    "ai_result_id": "7",
    "trace_id": "trace-fixture-001",
    "command_id": "command-fixture-001",
    "correlation_id": "correlation-fixture-001",
    "causation_id": "11111111-1111-4111-8111-111111111111",
    "idempotency_key": null,
    "payload_json": {
      "candidate_only": true,
      "task_status": "ready",
      "producer_component": "ai_worker",
      "format_status": "passed"
    }
  }
]
