[
  {
    "schema_version": "0.1.3",
    "event_id": "10100000-0000-4000-8000-000000000001",
    "event_name": "identity.user.registered",
    "occurred_at": "2026-07-29T10:00:00Z",
    "module": "identity",
    "result_status": "success",
    "source_type": "server",
    "privacy_class": "pseudonymous",
    "user_id": "10",
    "session_id": "session-public-10",
    "trace_id": "trace-s1-identity-1",
    "command_id": "command-s1-identity-1",
    "payload_json": {"producer_component": "business_api", "system_role": "user"}
  },
  {
    "schema_version": "0.1.3",
    "event_id": "10100000-0000-4000-8000-000000000002",
    "event_name": "project.project.created",
    "occurred_at": "2026-07-29T10:01:00Z",
    "module": "project",
    "result_status": "success",
    "source_type": "server",
    "privacy_class": "internal_id",
    "user_id": "10",
    "project_id": "20",
    "project_version_id": "21",
    "trace_id": "trace-s1-project-1",
    "command_id": "command-s1-project-1",
    "payload_json": {"initial_version_id": "21", "startup_mode": "blank"}
  },
  {
    "schema_version": "0.1.3",
    "event_id": "10100000-0000-4000-8000-000000000003",
    "event_name": "project.version.working_set",
    "occurred_at": "2026-07-29T10:02:00Z",
    "module": "project",
    "result_status": "success",
    "source_type": "server",
    "privacy_class": "internal_id",
    "user_id": "10",
    "project_id": "20",
    "project_version_id": "22",
    "trace_id": "trace-s1-version-1",
    "command_id": "command-s1-version-1",
    "payload_json": {"previous_working_version_id": "21", "new_working_version_id": "22"}
  },
  {
    "schema_version": "0.1.3",
    "event_id": "10100000-0000-4000-8000-000000000004",
    "event_name": "file.upload.completed",
    "occurred_at": "2026-07-29T10:03:00Z",
    "module": "file",
    "result_status": "success",
    "source_type": "server",
    "privacy_class": "confidential",
    "user_id": "10",
    "project_id": "20",
    "project_version_id": "22",
    "object_type": "stored_file",
    "object_id": "30",
    "object_version_id": "31",
    "trace_id": "trace-s1-file-1",
    "command_id": "command-s1-file-1",
    "payload_json": {"file_version_id": "31", "checksum_sha256": "aaaaaaaaaaaaaaaaaaaaaaaaaaaaaaaaaaaaaaaaaaaaaaaaaaaaaaaaaaaaaaaa", "duration_ms": 250}
  },
  {
    "schema_version": "0.1.3",
    "event_id": "10100000-0000-4000-8000-000000000005",
    "event_name": "identity.session.login_succeeded",
    "occurred_at": "2026-07-29T10:04:00Z",
    "module": "identity",
    "result_status": "success",
    "source_type": "server",
    "privacy_class": "pseudonymous",
    "user_id": "10",
    "session_id": "session-public-10",
    "trace_id": "trace-s1-identity-2",
    "command_id": "command-s1-identity-2",
    "payload_json": {"producer_component": "business_api", "authentication_method": "password"}
  },
  {
    "schema_version": "0.1.3",
    "event_id": "10100000-0000-4000-8000-000000000006",
    "event_name": "identity.session.login_failed",
    "occurred_at": "2026-07-29T10:05:00Z",
    "module": "identity",
    "result_status": "failed",
    "failure_code": "INVALID_CREDENTIALS",
    "source_type": "server",
    "privacy_class": "pseudonymous",
    "trace_id": "trace-s1-identity-3",
    "command_id": "command-s1-identity-3",
    "payload_json": {"producer_component": "business_api", "reason_class": "credentials_rejected"}
  },
  {
    "schema_version": "0.1.3",
    "event_id": "10100000-0000-4000-8000-000000000007",
    "event_name": "identity.session.refreshed",
    "occurred_at": "2026-07-29T10:06:00Z",
    "module": "identity",
    "result_status": "success",
    "source_type": "server",
    "privacy_class": "pseudonymous",
    "user_id": "10",
    "session_id": "session-public-11",
    "trace_id": "trace-s1-identity-4",
    "command_id": "command-s1-identity-4",
    "payload_json": {"producer_component": "business_api", "rotation_succeeded": true}
  },
  {
    "schema_version": "0.1.3",
    "event_id": "10100000-0000-4000-8000-000000000008",
    "event_name": "identity.session.refresh_replay_blocked",
    "occurred_at": "2026-07-29T10:07:00Z",
    "module": "identity",
    "result_status": "blocked",
    "failure_code": "TOKEN_REUSE_DETECTED",
    "source_type": "server",
    "privacy_class": "pseudonymous",
    "user_id": "10",
    "session_id": "session-public-10",
    "trace_id": "trace-s1-identity-5",
    "command_id": "command-s1-identity-5",
    "payload_json": {"producer_component": "business_api", "family_revoked": true}
  },
  {
    "schema_version": "0.1.3",
    "event_id": "10100000-0000-4000-8000-000000000009",
    "event_name": "identity.session.logged_out",
    "occurred_at": "2026-07-29T10:08:00Z",
    "module": "identity",
    "result_status": "success",
    "source_type": "server",
    "privacy_class": "pseudonymous",
    "user_id": "10",
    "session_id": "session-public-11",
    "trace_id": "trace-s1-identity-6",
    "command_id": "command-s1-identity-6",
    "payload_json": {"producer_component": "business_api", "revocation_reason": "logout"}
  },
  {
    "schema_version": "0.1.3",
    "event_id": "10100000-0000-4000-8000-000000000010",
    "event_name": "identity.session.revoked",
    "occurred_at": "2026-07-29T10:09:00Z",
    "module": "identity",
    "result_status": "success",
    "source_type": "server",
    "privacy_class": "pseudonymous",
    "user_id": "10",
    "session_id": "session-public-12",
    "trace_id": "trace-s1-identity-7",
    "command_id": "command-s1-identity-7",
    "payload_json": {"producer_component": "business_api", "revocation_reason": "administrative"}
  }
]
